Video ID,Title,Published At,Views,Likes,Dislikes,Comments
7qtrLK0L8NY,UNBELIEVABLE FLORIDA MOMENTS CAUGHT ON CAMERA!,2024-01-07T17:00:10Z,387887,25758,0,487
e7egFRmoWtE,BEST OF SIDEMEN REACTS 2023,2023-12-31T17:30:08Z,1307887,50974,0,687
y7mrmGT1gmI,"SIDEMEN REACT TO ""THE WORLD’S WORST CHRISTMAS MOVIE""",2023-12-26T17:30:10Z,1340986,79876,0,619
M7kR9cRXZPs,HILARIOUS DRUNK FAILS!,2023-12-23T17:30:03Z,990575,45226,0,388
v3jTObaPnXM,FUNNIEST VIRAL MEMES EVER!,2023-12-21T17:30:05Z,1046368,56123,0,478
yWoFGc5TFR8,PEOPLE HAVING BAD LUCK!,2023-12-20T17:31:53Z,621501,38528,0,1018
zd0K93Clegc,CRAZIEST INSTANT REGRETS!,2023-12-18T17:30:10Z,608467,42136,0,717
gi72otZYWXQ,HILARIOUS SUNDAY LEAGUE FOOTBALL MOMENTS!,2023-12-17T18:00:17Z,1427703,63684,0,378
T1xoCjL1Tb0,ADULTS JOKES IN KIDS SHOW,2023-12-15T19:01:41Z,1194059,55523,0,992
UQxKAHIoWW4,BEST SIDEMEN QUIPLASH MOMENTS!,2023-12-14T17:30:05Z,793562,43061,0,445
dDcWKLcftWA,PRANKS THAT WENT TOO FAR!,2023-12-13T17:28:47Z,1078014,51001,0,433
qSHDUbUCPPA,Most OFFENSIVE TV Show Ever! (Robot Chicken),2023-12-10T17:00:42Z,620058,40159,0,556
GzmUu90gzfg,SIDEMEN BEST GTA MOMENTS,2023-12-09T17:30:01Z,1035875,51597,0,378
y3faOKuKPGQ,BEST OF ANGRY GINGE RAGE MOMENTS,2023-12-02T17:30:10Z,1467034,62663,0,319
Rf2vtHoFWx0,WHEN CRIMINALS ARE *SMARTER* THAN THE POLICE,2023-11-30T17:30:06Z,1261710,53138,0,437
6f-hXy6ckSI,W2S MOST OFFENSIVE MOMENTS OF ALL TIME!,2023-11-19T17:30:01Z,2125344,98058,0,707
jgTux2N_0kE,xQc didn’t stand a chance! Show us your favourite charity match celebration #sidemencelebration,2023-09-20T18:02:26Z,95477,3172,0,23
TorqlVHg9Mo,WATCH THIS WITH YOUR EYES CLOSED,2023-09-20T14:00:20Z,185055,7931,0,52
PGnoSBBxYvU,What a strike! Show us your favourite charity match celebration #sidemencelebration,2023-09-15T18:31:00Z,102949,4472,0,24
gmIlhCAF09E,Who had the best goal celebration? Show us your favourite! #sidemencelebration,2023-09-12T17:28:48Z,132036,6109,0,82
o3nZKntKssg,Want a chance to win a signed match shirt? Show us your favourite celebration #sidemencelebration,2023-09-10T16:00:39Z,147340,7876,0,70
G1Ako8j6GX0,It’s not too late to submit your #sidemencelebration,2023-09-08T17:00:10Z,214112,14291,0,106
I3oWT9umJ9w,HE PLED THE 5TH,2023-09-08T14:00:19Z,1175608,67050,0,184
LTyUoKIxFLs,HE'S NOT INVITED BACK,2023-09-05T14:00:21Z,322957,15902,0,86
Bh9JCv9gmnc,THESE WILL MAKE YOU UNCOMFORTABLE,2023-09-04T14:00:08Z,982123,92495,0,106
AaXahsf5NsU,Do you think they’ll score? Show us your best #SidemenCelebration,2023-09-01T17:00:05Z,161799,11815,0,57
yIs4AG5VKE8,Think you can do better? show us your best #SidemenCelebration,2023-08-30T17:00:39Z,281914,15738,0,45
twp1MQwpKKg,KANYE HAS POWERS!,2023-08-25T14:00:39Z,226822,14844,0,81
7dT9RaER9OE,EARTHQUAKE,2023-08-24T14:00:04Z,362745,21041,0,47
1Mal4sMmzEQ,Create a Short and show us your best #SidemenCelebration,2023-08-23T19:14:39Z,115641,5409,0,44
ytkYlfxRe6I,Top bins? Show us your #SidemenCelebration,2023-08-17T17:23:40Z,163593,7988,0,54
1bCmc8ekIz4,Oh No Simon...,2023-08-09T14:00:02Z,448758,27770,0,70
5CvIKHSEAuQ,BOWLING IS DANGEROUS,2023-07-25T14:00:04Z,431545,21011,0,31
uxUIJiRlnos,WOULD YOU RATHER...,2023-07-20T14:00:39Z,178885,9489,0,78
OI71HBxxrSA,SPEED WHEN HE SCORES AT THE SDMN MATCH,2023-07-19T14:00:15Z,212606,11362,0,19
-mBPVu5vTik,WHY XQC IS THE JUICER!,2023-07-18T19:15:00Z,314951,18518,0,89
daYdAH7tqDs,SNOWBALL TO THE FACE!,2023-07-15T14:00:32Z,211865,13421,0,92
PVvFZSMzGdg,KSI IS AN ATHLETE!,2023-07-11T14:00:24Z,307373,15000,0,44
6_UaFAJGWBI,THEY LAGGED OUT!,2023-07-10T14:00:04Z,381551,24099,0,33
q6xiKiJ5hJA,"NOT TOBI""S PROUDEST MOMENT",2023-07-09T14:00:36Z,282033,15880,0,46
0zBh6lsW-CE,PEOPLE WITH 2 IQ!,2023-06-29T16:30:00Z,2462488,90681,0,1078
RihryAc50PQ,WOULD YOU HAVE KEPT THE MONEY?,2023-06-29T14:00:27Z,704862,54203,0,129
NAyrCenmFeU,FACTS THAT WILL MAKE YOU QUESTION EVERYTHING!,2023-06-28T16:30:04Z,1483252,73230,0,2031
FDKm6GBMBzg,PEOPLE GETTING *CAUGHT IN 4K*,2023-06-27T16:30:05Z,1688792,75611,0,619
MCIe3yCowfU,MOST ICONIC *SNOOP DOGG* CLIPS!,2023-06-26T16:15:01Z,1614627,70722,0,537
3WogwiJb658,IT COULD HAVE BEEN WORSE!,2023-06-26T14:00:03Z,100129,4455,0,34
Eo5s_ta8ijw,FUNNIEST UK TIKTOKS!,2023-06-25T17:00:11Z,1691671,69229,0,805
nnC7g0TaCng,WHEN SIDEMEN VIDEOS GO WRONG,2023-06-25T14:00:35Z,309243,15985,0,51
QAwMFdrHURM,MILDLY OFFENSIVE TIKTOKS!,2023-06-24T16:45:00Z,1404709,63882,0,686
fshpPo4keZw,THIS TRIGGERED KSI!,2023-06-24T14:00:34Z,1540552,124828,0,310
1nPHixIh7Gs,BEST *SIDEMEN MONEY* MOMENTS,2023-06-22T16:00:04Z,1078215,51323,0,653
ivySw9OnNH0,SIDEMEN *WOULD YOU RATHER* CHALLENGE #2,2023-06-21T16:00:36Z,2342596,85973,0,1562
rR1y30DEmTc,ADULT JOKES IN KIDS SHOWS!,2023-06-20T16:30:13Z,1911708,84808,0,1214
wHT6EadRLIw,MOST AWKWARD TIKTOKS YOU WILL EVER SEE!,2023-06-17T16:30:09Z,1113489,50357,0,525
onTcSDJPpTs,MOST OUTRAGOUS *THEO VON* MOMENTS!,2023-06-16T16:15:03Z,2635584,128669,0,990
nnV3bBSc-Yo,MOST ICONIC SIDEMEN MEMES OF ALL TIME!,2023-06-15T16:45:03Z,1795992,105294,0,882
TKVQYe8sXDg,THAT WAS A VIOLATION!,2023-06-15T14:00:27Z,3332089,252411,0,319
4lKvn43z0co,OUT OF CONTEXT HUMANS!,2023-06-14T16:15:00Z,1280603,98861,0,1611
jLy8-KIJeQc,BEST GAMING ROOMS YOU WILL EVER SEE!,2023-06-13T16:15:02Z,996322,42860,0,899
F9OFsr0C9Vg,MOST DISRESPECTFUL FANS IN SPORTS!,2023-06-12T16:30:01Z,695838,38918,0,504
Tjs2mOZZQZE,BEST SIDEMEN INSULTS OF ALL TIME!,2023-06-10T16:15:01Z,1531917,72345,0,469
ORgmIBf35uo,BEST *JOE ROGAN* MOMENTS!,2023-06-09T16:15:01Z,2431170,93243,0,845
VaKmpCSrfNA,CLIPS THAT MADE GORDON RAMSAY FAMOUS!,2023-06-08T17:00:28Z,1495304,72083,0,621
jsr2yFl98AQ,WHY KSI HATES ICE SKATING,2023-06-07T18:00:18Z,248534,15756,0,102
Ceq1kPQT0p8,BEST PHOTOSHOP TROLLS!,2023-06-07T16:30:03Z,1429364,73723,0,592
T8xLxB-_224,KSI IS COMING FOR MO,2023-06-06T18:00:11Z,237076,13446,0,48
FcsaW7KC0ls,MOST DISRESPECTFUL UFC MOMENTS!,2023-06-04T16:00:17Z,1705797,68121,0,778
6teiR2BpNMQ,WORST SIDEMEN AMONG US THROWS OF ALL TIME!,2023-06-03T16:15:00Z,2039875,92326,0,579
y1IB77B4iH0,SIDEMEN REAL OR AI CHALLENGE!,2023-06-02T16:00:45Z,1080405,57791,0,934
o7db-YuRrJQ,PLACES YOU SHOULD NEVER SEARCH ON GOOGLE!,2023-06-01T16:00:39Z,1663513,63081,0,680
d3DZYuLGjFo,MOST AWKWARD YOUTUBE BOXING MOMENTS!,2023-05-31T16:15:03Z,1829859,65128,0,453
7mQ2ZjL3J5Y,WAKE UP,2023-05-29T16:00:06Z,250759,19073,0,66
5zWhjzgDqb8,"""HAVE I DONE SOMETHING STUPID?""",2023-05-28T18:00:02Z,666753,48445,0,286
c01Rr3yK6CY,WATCH OUT FOR UNCLE HARRY,2023-05-27T18:00:24Z,490567,41618,0,108
lD0bzwJyxDM,OUT OF CONTEXT JEREMY WADE,2023-05-27T16:00:23Z,1246986,75704,0,1211
rNG2qEX-uss,MOST INSANE RALLY CRASHES!!,2023-05-26T16:15:03Z,837126,48882,0,758
4Qh_AJ4Gls4,BIGGEST SPORTS HITS OF ALL TIME!!,2023-05-25T16:15:00Z,1882247,68517,0,1876
6ucExdiR9_w,OFFENSIVE OMEGLE MOMENTS!,2023-05-24T16:30:02Z,1441158,67680,0,748
lNqdvj4rdmY,ICONIC BRITISH MEMES!,2023-05-23T16:00:35Z,2644293,86782,0,1097
vAcbSLJGUck,THE BRIDGE INCIDENT,2023-05-23T14:00:29Z,741334,39120,0,135
d1hdy5rhciE,NEXT SIDEMEN CHARITY MATCH GOALIE REVEAL,2023-05-22T14:00:18Z,416192,21728,0,62
KmyvDMFTpPA,HASBULLA IS JUST MINI W2S,2023-05-21T14:00:09Z,1237368,75356,0,89
C2VCKDVy33A,IS THIS WHOLESOME?,2023-05-20T18:00:10Z,288793,13365,0,58
hDPmctDXFcE,BEST BOXING WALKOUTS OF ALL TIME!,2023-05-19T17:00:27Z,857788,38487,0,761
buhwPPyXEe4,PERFECTLY TIMED MOMENTS ON TWITCH!,2023-05-17T16:00:27Z,1156886,51486,0,467
aWcl0MZJ2As,WHY ALIENS MAY ALREADY BE ON EARTH!,2023-05-15T16:15:00Z,943307,54350,0,1446
Rpqm8usnmzY,W2S HAS NEVER SEEN ONE OF THESE,2023-05-14T19:00:08Z,1132077,69043,0,269
0g_JxrhXaKI,"BEST ""TO CATCH A PREDATOR"" MOMENTS!",2023-05-14T16:30:00Z,2023481,78150,0,1649
wEUevjZNaos,ETHAN LOVE HIS DOG,2023-05-13T19:00:30Z,238062,11483,0,50
i_vMGZu11j0,EXTREMELY UNUSUAL MEMES!,2023-05-13T15:45:04Z,1002673,51501,0,528
w9RC1cbpzTQ,KSI IS NOT OK,2023-05-12T19:00:21Z,355604,22729,0,83
38R0toBVZpY,BEST MISFITS BOXING MOMENTS *SO FAR*,2023-05-12T16:15:00Z,1352976,58046,0,548
FqbUFlRkZQo,CELEBRITIES GETTING *HUMILIATED* IN PUBLIC,2023-05-10T16:15:00Z,1224714,59614,0,440
SSxvhym0VCc,MOST PAINFUL THINGS IN THE WORLD!,2023-05-09T16:15:01Z,2344462,101076,0,2277
OXMG9rVKEE0,THEY ALL HAVE DOGS!,2023-05-06T14:00:23Z,234882,11755,0,41
LsDxrhOGZ5U,BEST SIDEMEN HOLIDAY MOMENTS!,2023-05-05T16:30:03Z,1340988,62920,0,562
BWAhyzkvqeQ,KSI HAS AN IDEA!,2023-05-04T19:00:03Z,731135,44745,0,109
F1xXH4eerT4,BEST SIDEMEN LOCKDOWN AMONG US MOMENTS!,2023-05-04T16:30:02Z,1785714,85455,0,490
IeEizr8NAFU,INSANE FACTS THAT YOU WON’T BELIEVE,2023-05-03T16:15:01Z,1123733,52484,0,648
ziUNOMzoxig,EXTREMELY HARD TO WATCH TIKTOKS!,2023-05-01T16:38:36Z,1208146,59015,0,872
klqzLhA8vqs,MOST OUTRAGEOUS TV COMMERCIALS!,2023-04-28T16:30:08Z,933730,47967,0,526
TNXwQAAjdFI,GREATEST ESPORTS MOMENTS IN HISTORY!,2023-04-27T16:00:17Z,933501,42483,0,883
G35pcDoSL4Y,WHO MAKES THE MOST MONEY?,2023-04-26T16:15:00Z,963357,45543,0,484
wHNaAFfXcOc,HE DOES IT AGAIN!,2023-04-25T14:00:24Z,1387112,118412,0,263
Vx-TXxhdXvA,27 FACTS THAT WILL MAKE YOU QUESTION EVERYTHING!,2023-04-24T16:41:40Z,851546,47421,0,2412
a73XsqEaiDY,INSTANT KARMA MOMENTS IN SPORTS!,2023-04-23T16:30:00Z,1440858,58684,0,815
GzqgSWBZQhY,HARDEST BOXING KNOCKOUTS!,2023-04-22T16:30:06Z,1311654,52944,0,602
I8eajHyqcPM,GUESS WHAT HAPPENS NEXT CHALLENGE!,2023-04-21T16:30:02Z,1045086,55608,0,783
__0jnsiAH6A,REFEREE GETS SMOKED!,2023-04-20T15:00:27Z,115298,5542,0,15
wu784EDGHfI,SECONDS BEFORE DISASTER!,2023-04-19T16:30:07Z,1676044,72723,0,550
VS7AUtLsvps,NEYMAR OR WORLD PEACE?,2023-04-15T15:00:28Z,215345,11012,0,25
dOBB4SRyT80,WORLDS MOST TALENTED PEOPLE!,2023-04-12T16:15:01Z,993950,49397,0,675
LRwgMwOcK8s,HE PAUSED MID GAME FOR THIS,2023-04-12T15:00:11Z,936903,66495,0,86
23pQCpHCJtY,BEST INTERNET MOMENTS OF 2022!,2023-04-11T16:15:00Z,1590120,75381,0,957
n1byRu45fbI,EXTREMELY CONFUSING TIKTOKS!,2023-04-10T19:59:13Z,1081572,62352,0,1481
p2J3QY0lpmM,PLACES THAT *SCIENTIFICALLY SHOULDN'T EXIST*!,2023-04-02T16:15:02Z,1981381,80067,0,2045
GODs9fWQC2I,DANNY AARONS WILD DREAM,2023-04-02T15:00:08Z,224705,13217,0,39
A1keKDUUrPs,MOST OFFENSIVE TIKTOKS OF ALL TIME!,2023-04-01T16:00:11Z,2062712,166269,0,4316
zbJMTHvpfKM,SOMEONE ACTUALLY BROKE INTO GIBS HOUSE,2023-04-01T15:00:46Z,1575451,115833,0,236
NGiHhpIGmE0,MOST UNHINGED RAP LYRICS!,2023-03-31T16:30:08Z,1625942,76159,0,1079
Gol5T4YqTuw,THE TIME SIDEMEN GOT RUN UP ON,2023-03-31T15:00:19Z,704009,39441,0,135
uexgO7ae0lg,EXTREMELY STRANGE TIKTOKS!,2023-03-30T16:00:44Z,1489872,75882,0,510
PIcDFP4SCQM,10 BAD GUYS,2023-03-30T15:00:28Z,990130,85043,0,170
gQx6H3POCQM,TIKTOKS THAT WILL MAKE YOU GIGGLE!,2023-03-29T16:00:28Z,2038768,88530,0,441
_Ct7a4hPFr4,FUNNIEST SIDEMEN TWITCH MOMENTS!,2023-03-28T16:00:18Z,2732541,112797,0,736
obkqcf9bUIE,KSI IS GETTING PUNCHED FOR THIS,2023-03-28T15:00:29Z,953599,74037,0,259
Rt_tQ55YXoU,MOST ICONIC UFC INTERVIEW MOMENTS!,2023-03-25T17:00:12Z,1059058,45719,0,477
D-4QL93B2GQ,ONLY KSI WOULD GOOGLE SEARCH THIS!,2023-03-25T15:00:15Z,856244,56722,0,196
uAwZwltDtdg,FUNNIEST TGF MOMENTS OF ALL  TIME!,2023-03-22T17:00:29Z,1926955,73626,0,946
a1qNwMCUP7U,ICONIC *KSI FIFA PACK OPENING* MOMENTS!,2023-03-21T16:00:00Z,1299659,60697,0,1053
Fa8rlAXx4mY,HE HAS THE SIXTH SENSE,2023-03-20T15:00:07Z,379984,33658,0,65
n29ACWcH_gE,THESE TIKTOKS WILL MAKE YOU WHEEZE!,2023-03-19T17:00:34Z,1656249,77482,0,743
LBNmGdcWyGk,TIKTOKS THAT WILL MAKE YOU LAUGH!,2023-03-18T17:15:00Z,1957951,108202,0,889
9OI9tma1I4g,PEOPLE HAVING A REALLY BAD DAY!,2023-03-17T17:15:00Z,1242330,59492,0,444
8JEMecTWt8c,FAMILY GUYS MOST OFFENSIVE MOMENTS (PART 7),2023-03-16T17:08:48Z,3680180,161877,0,1324
25bj2c5sxJs,THIS ALMOST GOT US BANNED!,2023-03-16T14:00:01Z,807889,42229,0,147
j1CraZsDl5Q,EXTREMELY QUESTIONABLE RAP LYRICS!,2023-03-15T17:15:02Z,2347950,113955,0,1826
qIFhd6jqGdo,THERE WAS NO NOTE,2023-03-15T15:00:37Z,597096,36664,0,114
33Sie_8KQdQ,KSI DUMBEST MOMENTS OF ALL TIME!,2023-03-14T17:15:00Z,1823156,96718,0,982
foXt4kxWVEI,HOW NOT TO DO THIS...,2023-03-14T15:00:33Z,171661,9048,0,21
i0UkTPF_oTE,BEST *KAI CENAT SUBATHON* MOMENTS!,2023-03-12T16:30:13Z,1546645,77537,0,475
by5eyaS56vw,TOBI GETS EXPOSED,2023-03-12T15:00:20Z,1406905,91626,0,117
PdDsqxf__Nc,YOUTUBE SHORTS THAT WILL OFFEND YOU!,2023-03-11T17:30:05Z,2015537,100626,0,586
2IPAreDfOTA,MOST ICONIC *TBJZL* MOMENTS OF ALL TIME!,2023-03-10T17:15:00Z,1970835,85554,0,826
vLuy2lm-M94,KSI REVEALS IT ALL,2023-03-10T16:00:37Z,592663,33519,0,85
kqTskt8veL0,BIGGEST SIDEMEN GTA FAILS!,2023-03-09T17:15:02Z,1479444,72708,0,696
klZiJbUuSZg,FUNNIEST TWITCH STREAMER FAILS!,2023-03-08T17:15:01Z,1148758,61781,0,313
EGJWFNo_TvY,HE WENT ON A HIKE,2023-03-08T15:00:07Z,183964,15182,0,35
vrOlK2hfpd4,THESE TIKTOKS WILL MAKE YOU *UNCOMFORTABLE*,2023-03-06T17:30:07Z,1841120,78487,0,652
ZyqkuP0eAk4,EXTREME TRY NOT TO LAUGH!,2023-03-05T17:00:21Z,2579594,105692,0,602
EGJWFNo_TvY,HE WENT ON A HIKE,2023-03-08T15:00:07Z,183964,15182,0,35
vrOlK2hfpd4,THESE TIKTOKS WILL MAKE YOU *UNCOMFORTABLE*,2023-03-06T17:30:07Z,1841120,78487,0,652
ZyqkuP0eAk4,EXTREME TRY NOT TO LAUGH!,2023-03-05T17:00:21Z,2579594,105692,0,602
4aFhuoFq2Ns,MOST *UNIQUE NIKE SHOES* IN THE WORLD!,2023-03-04T17:11:15Z,906312,43702,0,603
kPYC_MlO67c,WEIRDEST TABOOS AROUND THE WORLD!,2023-03-03T17:15:02Z,1257348,62255,0,1041
ZyFOjrArbLI,SIDEMEN *FOOD* MOMENTS!,2023-03-02T17:00:17Z,1616877,76638,0,1003
-eTsRaVrlRE,CRINGE GAMER MOMENTS!,2023-03-01T17:00:00Z,1007680,52459,0,467
QyKUmSEq1UE,THE BLUE DRINK SIDE EFFECTS,2023-03-01T16:00:25Z,655936,43528,0,82
2y_AnpZGRsQ,WEIRDEST THINGS CAUGHT ON CAMERA!,2023-02-28T17:15:00Z,1146667,55913,0,579
btco0jKKWZk,TOBI IS COMING FOR MINIMINTER!,2023-02-28T15:00:25Z,1155851,82980,0,97
lwjS86SlKXs,CRAZIEST SPORT MALFUNCTIONS IN HISTORY!,2023-02-27T17:15:01Z,1268173,62098,0,802
hY3S2NWjmm4,TIKTOK LIFE HACKS THAT ACTUALLY WORK!,2023-02-26T17:00:34Z,1369228,70922,0,1010
fss3HE4nolQ,SO OUTRAGEOUS THAT TOBI LEFT,2023-02-26T15:00:23Z,5898292,349785,0,3570
n_qKg0HHk0c,CLIPS THAT MADE *ADIN ROSS* FAMOUS,2023-02-24T18:49:56Z,1577450,72960,0,1066
wsKyicRY4_M,SIDEMEN BEING BAD AT SPORTS FOR 9 MINUTES,2023-02-23T17:00:41Z,1521929,69470,0,688
9a6muh-mDU0,VIKSTAR HAS NO CHILL,2023-02-23T16:00:09Z,1744417,100503,0,164
uzXBxL666Y4,WHEN SIDEMEN VIDEOS *GO WRONG*,2023-02-22T17:54:53Z,1491670,79714,0,652
43mZcJdx-qw,WHEN THE GENDER REVEAL GOES WRONG,2023-02-22T16:00:02Z,993214,77374,0,86
_kXibyiV5ME,LUCKY DISCOVERIES WORTH *MILLIONS*!,2023-02-21T17:00:19Z,1767811,77557,0,590
pZcoRqsDOuE,SIDEMEN BEING GOOD AT FOOTBALL FOR 12 MINUTES,2023-02-17T17:20:00Z,3184802,116378,0,998
JdNCuDN_aVg,JESUS IS WATCHING TOBI,2023-02-17T16:00:12Z,842979,50087,0,102
EKA-h4VzIho,CLIPS THAT MADE *HASBULLA* FAMOUS!,2023-02-16T17:00:08Z,2206974,95008,0,885
TqyYKYtjHDo,WHEN THE JOKE DOESN'T HIT,2023-02-16T16:00:15Z,780115,56882,0,293
7frYRTZBKt0,HOW VIKKSTAR ACCIDENTALLY CANCELLED HIMSELF!,2023-02-15T16:05:00Z,820496,46656,0,450
IWL5RGEtqU0,DARKEST HUMOUR ON THE INTERNET!,2023-02-14T17:00:11Z,2696317,114113,0,668
S1hyC_vTD7s,MOST SAVAGE COMEBACKS OF ALL TIME!,2023-02-13T17:15:03Z,2782278,111976,0,930
hgTy465XMMQ,CLIPS THAT MADE *DANNY AARONS* FAMOUS!,2023-02-10T17:00:26Z,2642890,98064,0,630
UBmuY-ex0wg,HARRY PACKS RONALDO!,2023-02-10T16:00:14Z,382645,30967,0,58
IZe45YDB038,SIMPSON'S FUNNIEST MOMENTS!,2023-02-08T17:30:01Z,1927323,86110,0,559
DmmgiuZLMSw,Miniminter's Birthday Surprise,2023-02-08T16:00:06Z,281382,18953,0,62
DryPFY1k3dw,VIKKSTAR'S MOST SAVAGE MOMENTS OF ALL TIME!,2023-02-07T17:15:00Z,1912158,98456,0,1020
e5rsd0H16MU,BIGGEST SIDEMEN IRL FAILS!,2023-02-06T17:25:00Z,2214575,99446,0,560
u-BUFwXR1NE,JOSH IS TOUCHING WHAT?!,2023-02-06T16:00:27Z,272706,14786,0,75
iJiNjgsDZ3c,MOST OUTRAGEOUS *SCARED STRAIGHT* MOMENTS!,2023-02-05T17:15:01Z,1876195,88681,0,785
69yORQPgLEM,KSI HAS STILL NOT GOTTEN IT,2023-02-04T16:00:04Z,342827,26129,0,45
UC7g7tFXoUM,IF YOU LAUGH YOU LOSE CHALLENGE!,2023-02-03T17:08:12Z,1993256,92615,0,557
8lN4Gr9AQyw,GOLDEN BENS UNCLE RICE,2023-02-03T16:00:06Z,212156,12474,0,35
dhTyrbJv--M,LEBRON JAMES MOST OUTRAGEOUS MOMENTS!,2023-02-02T17:00:33Z,1614296,84245,0,878
peHbguLKx0E,CLIPS THAT MADE *BEHZINGA* FAMOUS!,2023-02-01T17:00:37Z,1768818,87571,0,479
9sriihRVWBw,GENDER REVEALS *GONE WRONG*,2023-01-31T17:15:01Z,1524206,75706,0,584
jB8Bs07acws,WOODLEY FELL OFF + RATIO,2023-01-30T18:00:18Z,2006877,122031,0,402
z3aewoosuMw,BEST SIDEMEN GAMESHOW MOMENTS!,2023-01-30T17:09:03Z,1625001,78108,0,907
aDYfIJTUBeo,MOST BADASS MOMENTS IN UFC!,2023-01-29T17:00:01Z,3767991,117562,0,995
6X7Mm6Y2kTY,CLIPS THAT MADE CHUNKZ FAMOUS!,2023-01-28T17:28:26Z,4170933,138578,0,734
4cmNlu2KPTs,COMPLETELY UNEXPECTED TIKTOKS,2023-01-27T17:00:04Z,2067457,96869,0,571
qhZTlybyzTo,WHEN DRINKING *GOES WRONG*,2023-01-25T17:15:01Z,1560621,76500,0,494
uWIaFjMTDeI,IDIOTS IN CARS!,2023-01-24T17:15:02Z,1559629,79624,0,582
ba-8FOgZkmc,STREAMERS GETTING TROLLED BY CHAT!,2023-01-23T17:15:01Z,2358009,112338,0,670
cB-bjgUGslw,DARKEST HUMOUR TIKTOKS!,2023-01-21T17:15:02Z,2814442,134954,0,962
zGXjqeWYiu4,REAL LIFE NPCs,2023-01-20T17:30:11Z,1786541,83701,0,998
m2Dx3jZSfu0,BEST *CHEAP vs EXPENSIVE* MOMENTS!,2023-01-18T17:00:27Z,2273412,106219,0,494
7AwDKUsQafk,TOTAL IDIOTS AT WORK!,2023-01-17T17:30:01Z,1583808,74129,0,761
1TBhkWG-fCQ,BEST *JJ OLATUNJI* MOMENTS!,2023-01-16T17:25:57Z,3665398,148956,0,996
HvQAsPyODNo,SOCIAL MEDIA INFLUENCERS BEING *STUPID*,2023-01-15T17:20:00Z,2123407,89250,0,859
50WkRusCOo0,Behz Gets Stitched Up!,2023-01-12T16:00:03Z,327251,15856,0,89
TbVnIZsVQT8,YOU CAN'T CANCEL W2S,2023-01-11T15:00:17Z,458860,27348,0,98
mZPaL2izpBo,VERY *UNEXPECTED* TIKTOKS!,2023-01-10T17:15:03Z,1703276,87221,0,642
d4VJASq5j_8,Tobi Attempts A Pushup Clap,2023-01-09T19:00:25Z,207499,14523,0,60
2L7SrL5QUuo,BEST & WORST SIDEMEN JOKES OF ALL TIME!,2023-01-09T17:15:00Z,3837884,138690,0,571
1m1AKroxtCg,TIKTOKS THAT BELONG ON THE FBI WATCHLIST,2023-01-05T17:30:00Z,2333677,104611,0,764
vFZwZrKtuRk,MOST OFFENSIVE *DR.PHIL* MOMENTS!,2023-01-03T17:00:34Z,1220819,64032,0,799
R3SOhq4A4_w,THE SIDEMEN GRAND PRIX!,2023-01-01T17:00:20Z,2223566,105334,0,1137
OPy7HioVchY,PEOPLE GETTING CAUGHT *RED HANDED*,2022-12-29T17:15:00Z,1659578,76528,0,670
ruMViJ0XARg,BEST SIDEMEN GUEST MOMENTS!,2022-12-28T17:30:05Z,1513090,75543,0,453
K-xhcZxUKB0,FAMILY GUY MOST OFFENSIVE MOMENTS (PART 6),2022-12-27T17:15:00Z,6183464,256213,0,1662
mpZUwIJ_GuU,MOST SATISFYING FOOD VIDEO ON THE INTERNET,2022-12-26T17:00:33Z,1797129,72645,0,1180
44NRKZ8QRts,EXTREME TRY NOT TO LAUGH!,2022-12-25T17:00:02Z,2437317,135456,0,1221
qG5GxR-ZsN4,TIKTOKS THAT ARE *SLIGHTLY* OFFENSIVE!,2022-12-22T17:00:26Z,2929591,117234,0,508
As0-R_OClEU,THE BEGINNING OF DEJI'S VILLIAN ARC,2022-12-22T15:00:11Z,299115,17337,0,39
ARBiMmx8o74,"MOST BRUTAL MOMENTS ON ""THE BUTTON""",2022-12-21T17:30:52Z,1601303,77279,0,956
XLCho__wJwc,WORST KAREN FREAKOUTS!,2022-12-20T17:39:00Z,1371393,73837,0,620
C-A6n-7lb3M,MOST OFFENSIVE FOOTBALL CHANTS!,2022-12-19T17:00:06Z,1496338,67374,0,747
Cu53rHM81Dc,BEST SIDEMEN CHRISTMAS MOMENTS!,2022-12-18T18:45:42Z,1328139,72235,0,574
Y0WkxUVm2WI,CLIPS THAT MADE *STEPHEN TRIES* FAMOUS,2022-12-16T17:15:04Z,2860445,110713,0,564
GMratA9I3kA,BEST SIDEMEN GAMING FAILS OF ALL TIME!,2022-12-15T17:00:11Z,1291620,64091,0,369
IBj7m6VttkE,MOST OFFENSIVE DRILL LYRICS!,2022-12-14T17:00:10Z,2917226,110080,0,1649
QC2n03BcSUo,BEST *OLD KSI* MOMENTS!,2022-12-13T18:00:06Z,1933310,112569,0,1145
1xxVaC_wFLE,W2S BEING *BOG* FOR 10 MINUTES!,2022-12-12T17:00:03Z,4199859,170828,0,869
0YjQmWLwCiA,KSI WATCHING THE WORLD CUP...,2022-12-12T15:00:00Z,413911,29823,0,216
Jm_LVzARzjM,BEST *MORE SIDEMEN* MOMENTS OF ALL TIME!,2022-12-10T16:57:55Z,2105317,100621,0,644
MnOsmVapuFw,TRY NOT TO LAUGH: NO FRIENDS EDITION,2022-12-09T17:48:45Z,2488699,140260,0,2355
dHDiMcjnd9k,MEMES THAT ARE SLIGHTLY CURSED!,2022-12-08T17:00:31Z,3334846,116417,0,407
DW0W0ro06HU,DUMBEST KSI MOMENTS OF ALL TIME!,2022-12-07T17:00:11Z,2176359,120171,0,891
JEQD1US7Xj8,"SIDEMEN REACT TO ""CHRISTMAS DRILLINGS (OFFICIAL VIDEO)""",2022-12-06T17:58:34Z,2967840,156021,0,2372
Bi8GyibJCxo,"REACTING TO ""SIDEMEN - THIS OR THAT (OFFICIAL VIDEO)""",2022-12-05T17:30:00Z,3504401,214760,0,1701
8hHAv59VcYI,BEHZINGA'S MOST SUS DAD MOMENTS!,2022-12-04T17:00:23Z,3215507,117470,0,469
nf8-8yIyK5A,"MOST OFFENSIVE ""ONE QUESTION GO"" MOMENTS!",2022-12-02T17:09:33Z,1458907,93443,0,739
XH-Y52KmN0c,MOST UNEXPECTED TIKTOKS!,2022-12-01T17:00:29Z,2308104,99233,0,489
EB6horYwEo8,"SIDEMEN REACT TO ""WHICH EX WAS BEST IN BED""",2022-11-30T17:00:08Z,1633769,87361,0,1236
tIWal7-MoGM,FAMILY GUY'S MOST OFFENSIVE JOKES (PART 5),2022-11-29T17:00:27Z,6976132,263021,0,1232
7ph9N1RXF7Q,ATHLETES BREAKING THE LIMITS!,2022-11-28T18:10:06Z,1464408,75375,0,650
kYSOorUwVpw,MOST UNDER-RATED SIDEMEN MOMENTS!,2022-11-27T18:05:00Z,2704398,117778,0,530
1fPLnl0TyK0,KSI GETS CAUGHT IN 4K,2022-11-27T15:00:02Z,1392768,96248,0,392
6WDpFWIWEi4,THE MOST OFFENSIVE TIKTOKS!,2022-11-26T18:05:00Z,1617327,111419,0,925
J8Zm1kVQx20,TIKTOKS THAT WILL MAKE YOU UNCOMFORTABLE!,2022-11-25T21:13:06Z,1026758,58156,0,467
D5YSk0hGtzw,MOST OFFENSIVE MEAN TWEETS!,2022-11-21T18:00:10Z,2333215,122179,0,1043
Shmn4H9uXlo,KSI GETS SCARED OF HIS OWN SHADOW,2022-11-21T15:00:30Z,406054,23731,0,189
1eZHe8_HvcM,BEST SIDEMEN DRUNK MOMENTS!,2022-11-20T17:00:01Z,2268378,95794,0,471
1NAi6aY87uE,BEST SIDEMEN JUMPSCARES!,2022-11-18T17:00:04Z,1190753,64398,0,578
TQn5CxeOpGI,CLIPS THAT MADE *ZERKAA* FAMOUS,2022-11-17T17:00:20Z,1532304,85654,0,685
S9vU48tXNLY,WHEN SIDEMEN VIDEOS GO WRONG!,2022-11-15T17:00:30Z,3851077,136294,0,642
ujM32po827g,MOST EXTREME FAILS!,2022-11-12T16:33:09Z,1731296,83787,0,538
-YH-yoXUhdo,MOST UNLUCKY PEOPLE IN THE WORLD,2022-11-11T17:00:00Z,2069100,87476,0,552
MWK88P2Kt3U,BEST *SIDEMEN VOICE CRACK* MOMENTS,2022-11-08T17:11:41Z,2584797,113843,0,756
JfPPjRCZvZ0,MOST RIDICULOUS RAPPER MOMENTS!,2022-11-07T18:00:06Z,2783163,128544,0,1151
xdrmKD6Rl7U,TIKTOKS THAT FEEL *ILLEGAL*,2022-11-05T17:00:38Z,2470180,120336,0,845
sxe95xyQtn8,CLIPS THAT MADE *VIKKSTAR123* FAMOUS!,2022-11-04T17:00:42Z,1918517,102474,0,584
fEkPeQEjkQk,SPEED MOMENTS THAT TURNED INTO MEMES,2022-11-01T17:00:22Z,4960233,195324,0,1144
YFPJtdsqDMg,STREAMERS GETTING JUMP SCARED!,2022-10-31T17:21:51Z,1811066,95610,0,993
FMqFMr60A58,CLIPS THAT MADE *CHRISMD* FAMOUS,2022-10-27T16:00:14Z,2402240,89544,0,468
0hnIQty_tqM,FUNNIEST *ISHOWSPEED* FIFA MOMENTS!,2022-10-25T16:00:02Z,6975657,235062,0,1250
1oBef9wMmFI,FAMILY GUY'S MOST OFFENSIVE JOKES (PART 4),2022-10-23T16:11:07Z,9185128,354733,0,2685
M906EuogLKM,TIKTOKS THAT ARE *OFFENSIVE*,2022-10-20T16:00:11Z,3487552,181044,0,1434
np3oajBisWE,CLIPS THAT MADE *KAI CENAT* FAMOUS,2022-10-14T16:00:42Z,3954483,169754,0,1766
jtKqINwlNyw,BEST *SIDEMEN BEEF ERA* MOMENTS,2022-10-12T16:00:25Z,4312503,494471,0,1934
Psm4XIQKxgs,ICONIC  *MORE SIDEMEN* MOMENTS (PART 1),2022-10-09T16:30:02Z,2430999,108984,0,610
L6HiZQO_Mfw,TRY NOT TO CRINGE: YOUTUBER EDITION!,2022-10-08T16:00:40Z,2372686,139677,0,923
hcyXyHQKbmo,MOST ICONIC MARK GOLDBRIDGE MOMENTS!,2022-10-07T17:15:02Z,2771764,108610,0,914
cteVFC1M88k,TRY NOT TO CRINGE: AWKWARD EDITION,2022-10-03T16:00:23Z,1730652,81265,0,620
z1VXNWTjSqs,REJECTED SHARK TANK PITCHES THAT MADE MILLIONS!,2022-10-01T16:00:43Z,2683239,115132,0,991
au73Ye-jLCA,MOMENTS BEFORE DISASTER!,2022-09-30T16:00:02Z,1909415,84232,0,658
L8FRmZIdtYU,CLIPS THAT MADE *TOMMYINNIT* FAMOUS,2022-09-29T16:00:12Z,1512205,91970,0,1097
ufPitxb1ZFI,BEST STEPHEN TRIES CHARITY MATCH MOMENTS!,2022-09-27T16:00:41Z,3326451,155523,0,1223
AL32wj6M1oU,THE MOST ICONIC *KSIMON* MOMENTS,2022-09-26T16:00:11Z,1761265,106091,0,868
na4kg9atY9g,"SIDEMEN REACT TO ""HOW THE SIDEMEN BUILT A 100M EMPIRE""",2022-09-25T16:00:29Z,1633391,117244,0,1085
Lx-V9oQ1Psk,PEOPLE DYING INSIDE COMPILATION,2022-09-22T16:00:11Z,2626467,103926,0,880
A7jvLNnDeDw,UNLUCKIEST MOMENTS IN SPORTS!,2022-09-21T16:00:07Z,1900874,80331,0,851
XA2tBJJuT2s,REACTING TO “JIDION’S MOST ICONIC MOMENTS”,2022-09-20T16:00:17Z,1989671,94807,0,936
g1egDHVcN5I,ACTIVITIES THAT SHOULD BE ILLEGAL!,2022-09-18T16:00:18Z,978461,50967,0,537
oNG4OeuyCww,PERFECTLY TIMED TEXT TO SPEECH!,2022-09-17T17:24:45Z,2526814,116876,0,826
Ct0iAEpHtCE,10 TOURIST ATTRACTIONS THAT SHOULD BE ILLEGAL,2022-09-13T16:00:06Z,1451211,65503,0,882
aAA6Ryl8Dxg,"CLIPS THAT MADE ""CHRIS EUBANK"" FAMOUS!",2022-09-12T16:00:00Z,1127845,58638,0,718
_UHrzvCed9g,CLIPS THAT MADE *NIKO OMILANA* FAMOUS,2022-09-11T16:00:30Z,2019462,105743,0,829
EVVsFYke3aA,"CLIPS THAT MADE ""CONNOR MCGREGOR"" FAMOUS",2022-09-08T16:00:08Z,2958026,122812,0,1719
osDsbckcAgU,CLIPS THAT MADE *MINIMINTER* FAMOUS,2022-09-07T16:05:10Z,2127287,109672,0,994
YocR0_1yTfA,MOMENTS ATHLETES WERE CAUGHT CHEATING!,2022-09-06T16:15:02Z,3020563,112458,0,1361
cvIJWux53rc,INAPPROPRIATE ADULT JOKES IN KID CARTOONS!,2022-09-05T16:00:32Z,2446276,124913,0,1060
q-la_2J9gmg,BEST SIDEMEN 20v1 MOMENTS!,2022-09-03T16:00:24Z,5161770,290361,0,1496
8fmezEKm87w,WORST MAN MADE DISASTERS IN HISTORY,2022-09-01T16:00:06Z,1792007,79711,0,1457
7DPrAXRowKk,TIKTOKS THAT ARE RELATABLE!,2022-08-31T16:00:05Z,2698948,125889,0,829
aJ0N9v_UzTM,SIMON COWELL'S MOST SAVAGE MOMENTS,2022-08-30T16:00:00Z,2399960,125876,0,1294
0Jv-nS3V4Qs,THE LIFE OF A DUBAI BILLIONAIRE!,2022-08-29T16:00:00Z,1482648,71216,0,887
Jghl7ItUeAU,*DARK HUMOUR* TIKTOKS!,2022-08-28T16:00:18Z,5456975,254569,0,5712
xwgAvAAs02c,WORLDS SCARIEST ATTRACTIONS!,2022-08-27T09:00:25Z,1284421,64019,0,1289
87nmD9RycsQ,INCREDIBLE BOXING MOMENTS!,2022-08-26T16:00:06Z,3979291,166531,0,1503
cZfOzeqM3Bc,FAMILY GUY'S MOST OFFENSIVE MOMENTS (PART 3),2022-08-25T16:00:20Z,13747496,455565,0,3137
8rLkTyhg-Go,QUOTES THAT MADE THE *SIDEMEN* FAMOUS,2022-08-23T16:00:10Z,4066947,170686,0,861
V88enFTwaSk,WORLD'S MOST SATISFYING WORKERS,2022-08-22T16:15:01Z,1714574,128922,0,6299
