Video ID,Title,Published At,Views,Likes,Dislikes,Comments
B2FQZheOb48,THE MOST *OFFENSIVE* TIKTOKER,2022-08-19T16:00:06Z,8118847,353862,0,4879
Lw8R3RPxXSY,TOP DUMBEST SCIENCE EXPIREMENTS!,2022-08-18T16:00:21Z,2711689,118031,0,1657
YrsNsLtARIU,BEST SIDEMEN CROSSBAR CHALLENGE MOMENTS!,2022-08-07T16:00:31Z,1877550,95954,0,888
bzLwAjchMDE,STRANGEST DEATH ROW MEAL REQUESTS,2022-08-05T16:00:33Z,2838721,105310,0,1480
wuyJnBnFgzs,CLIPS THAT MADE *W2S* FAMOUS!,2022-08-04T16:00:29Z,6951432,216327,0,1787
mXile82gIPI,BODYBUILDERS THAT TOOK IT TOO FAR!,2022-08-03T16:00:36Z,4108967,140314,0,2833
_6ZriaTFx2I,FUNNIEST SIDEMEN HIDE AND SEEK MOMENTS,2022-08-02T16:05:00Z,2993589,130504,0,1052
lEiFkYavrfQ,FUNNIEST MILITARY FAILS OF ALL TIME!,2022-08-01T16:00:24Z,2011385,95174,0,1151
uIxdjTf7RJI,CLIPS THAT MADE *ISHOWSPEED* FAMOUS 2!,2022-07-31T16:00:36Z,7060397,257319,0,1844
5V94ARRE7tk,CHAOTIC TIKTOKS FROM GEN Z,2022-07-30T16:13:02Z,2599692,107627,0,908
DZw_LNdGhvU,SHOWER THOUGHTS THAT WILL KEEP YOU UP AT NIGHT!,2022-07-29T16:05:00Z,4004605,147693,0,1666
Q28Yx9KjiEM,CLIPS THAT MADE *KANYE WEST* FAMOUS!,2022-07-28T16:00:15Z,2978341,123709,0,1564
edjqMjvEGSY,25 LUCKIEST PEOPLE CAUGHT ON CAMERA,2022-07-27T16:00:24Z,1899932,82956,0,625
RHz9YpMO7TA,MOST OFFENSIVE SIDEMEN TINDER LINES!,2022-07-25T16:19:38Z,3837436,169958,0,1291
EQ4SQt4amxQ,BIGGEST HITS IN NFL HISTORY,2022-07-21T16:00:16Z,2893864,95845,0,5056
maDhSUHA5aA,FUNNIEST KSI CHARACTER MOMENTS!,2022-07-20T16:00:25Z,3366805,190054,0,2135
9PXY2bbM408,EVERYDAY OBJECTS BUT THEY ARE MASSIVE!,2022-07-19T16:00:05Z,1636319,75929,0,913
sp5EvkzM9p8,TOTAL IDIOTS AT WORK!,2022-07-16T17:15:02Z,3210298,152881,0,1774
S_aWUO3gG5o,FAMILY GUY MOST OFFENSIVE JOKES (PART 2),2022-07-15T16:00:27Z,17613176,542456,0,4024
8qXy9EStGZE,OUTRAGEOUS ANIMAL MOMENTS!,2022-07-14T16:00:07Z,2226104,91414,0,1016
VJnlQL3VsLw,TIKTOKS THAT ARE OFFENSIVE,2022-07-13T16:00:22Z,4355283,262121,0,4300
BMGJrbJTcbI,CLIPS THAT MADE *ANDREW TATE* FAMOUS,2022-07-11T16:00:14Z,10362836,391825,0,11551
loDkRKvu8l0,MIND BLOWING MOMENTS CAUGHT ON CAMERA!,2022-07-08T16:00:27Z,2305798,99887,0,608
qVS7ATeTETs,CLIPS THAT MADE *ISHOWSPEED* FAMOUS!,2022-07-07T16:00:36Z,14820345,661362,0,6590
L2Aq5gcGZsc,FUNNIEST DRAMATIC PET MOMENTS!,2022-07-06T16:00:20Z,1252216,67580,0,598
6Cy7l53flZ4,SOUTH PARK'S MOST OFFENSIVE JOKES,2022-07-05T16:00:04Z,6223792,273449,0,3213
DpjXPHYE70s,MOST OFFENSIVE *SIDEMEN CARDS AGAINST HUMANITY* MOMENTS!,2022-07-04T16:00:13Z,2147070,108624,0,1851
5bRlGJXTXXc,CRAZIEST ROAD MOMENTS CAUGHT ON CAMERA,2022-07-01T16:00:07Z,1788084,77820,0,1057
XPfRVzImiZc,MOST ICONIC FOOTBALL CLIPS OF ALL TIME!,2022-06-27T16:24:32Z,3009215,116491,0,1373
66M1r9wP7CY,40 LUCKIEST PEOPLE CAUGHT ON CAMERA,2022-06-26T16:00:07Z,1517511,74549,0,883
KxoZXHMSAWc,BEST SIDEMEN LOCKDOWN MOMENTS!,2022-06-24T16:00:22Z,2147992,100759,0,1115
_y_puKAziwA,FAILS THAT WILL HURT YOUR SOUL!,2022-06-23T16:00:19Z,2091307,92632,0,652
xojmrNcZy3E,TIK-TOKS THAT ARE ACTUALLY FUNNY!,2022-06-19T16:00:33Z,3251739,133550,0,655
ZbfjAfQH9_g,MOST OFFENSIVE SIDEMEN PRO CLUB MOMENTS!,2022-06-18T16:21:30Z,2284119,95511,0,1043
kbnnwI3EEyI,SIBLINGS OR DATING CHALLENGE!,2022-06-16T16:00:34Z,864127,50857,0,794
wbg1mVY0L5Q,BEST *OLD SIDEMEN ABROAD* MOMENTS!,2022-06-15T16:00:22Z,1542328,77887,0,581
ttJTCEbyiB4,WHY UNITED PAID $80 MILLION FOR MAGUIRE,2022-06-13T16:00:35Z,3464751,124416,0,2428
ZA1ExIIdLVE,BIGGEST LOTTERY WINNERS OF ALL TIME!,2022-06-11T16:00:17Z,1129027,54250,0,681
OvN1CTrZsd4,REAL PRISON ESCAPES CAUGHT ON CAMERA!,2022-06-09T16:00:11Z,1577457,71847,0,635
50121mr_qt0,SIDEMEN GUESS THE COUPLE!,2022-06-02T16:00:08Z,1335146,72642,0,572
dMNfKIP1mW4,UNUSUAL MEMES COMPILATION #185,2022-05-30T16:00:26Z,2380312,117348,0,771
1MNO2XGl9nc,MOST ICONIC/FUNNY KSI MOMENTS OF ALL TIME #1,2022-05-29T16:00:01Z,2955627,144850,0,808
qoLKsWOEVf4,TOP KAREN vs SUPERCAR MOMENTS!,2022-05-28T16:00:31Z,1438263,67630,0,637
07gflXwhbkU,FAMILY GUY'S MOST OFFENSIVE JOKES,2022-05-26T16:00:00Z,18061080,537856,0,3826
ksQci1owW2k,MOST ICONIC VIKKSTAR123 MOMENTS OF ALL TIME #1,2022-05-24T16:00:31Z,2595163,130871,0,714
7GYZFyOOPUk,BEST YOUTUBE BOXING KNOCKOUTS!,2022-05-23T16:00:04Z,2351956,88097,0,831
VXQba_a18co,BEST SIDEMEN AMONG US MOMENTS OF ALL TIME!,2022-05-22T16:00:18Z,2464877,129912,0,3041
V-SHo8ZMsMk,RICHEST PEOPLE IN THE WORLD!,2022-05-21T16:00:28Z,1135462,64041,0,1040
66sNldGqbwE,MOST LEGENDARY TRASH TALK IN FOOTBALL!,2022-05-20T16:15:00Z,2762218,110845,0,680
NFJZexTieTc,"BEST SIDEMEN 'YOUR MUM"" JOKES #1",2022-05-17T16:00:09Z,3852066,154226,0,1004
Ft0gnao13ro,A SOLID *8* MINUTES OF USELESS INFO!,2022-05-16T16:00:14Z,2215066,104602,0,879
Fxcj4nxLobU,REAL LIFE NPC CONVERSATIONS,2022-05-15T16:00:16Z,2872346,129009,0,1204
NFJZexTieTc,"BEST SIDEMEN 'YOUR MUM"" JOKES #1",2022-05-17T16:00:09Z,3852066,154226,0,1004
Ft0gnao13ro,A SOLID *8* MINUTES OF USELESS INFO!,2022-05-16T16:00:14Z,2215066,104602,0,879
Fxcj4nxLobU,REAL LIFE NPC CONVERSATIONS,2022-05-15T16:00:16Z,2872346,129009,0,1204
hvdGRTxXdMY,WORST SIDEMEN INJURIES OF ALL TIME!,2022-05-12T16:00:25Z,2641548,149964,0,798
KLqAzDh1zXg,LESS THAN 1% OF PEOPLE CAN DO THIS...,2022-05-10T16:00:11Z,1099003,58990,0,711
S0_cjij6xZk,LARGEST MAN MADE THINGS EVER BUILT,2022-05-08T16:00:12Z,1071962,62704,0,779
_ZqyZdyyjF0,MOST EMBARRASSING MOMENTS IN SPORTS!,2022-05-07T16:00:12Z,1475453,108236,0,1283
vMfMRhivcsc,TOP *LIKE A BOSS* MOMENTS,2022-05-06T16:00:27Z,1798031,83120,0,2043
2EhfuNm8TFE,CRAZIEST THINGS EVER SOLD ON THE *DARK WEB*,2022-05-04T16:00:01Z,2665497,114417,0,1403
xaS3waWZm2c,KSI GETTING BULLIED FOR 11 MINUTES,2022-05-03T16:00:35Z,4371896,205591,0,1457
52ApmIjMQso,WHY YOU SHOULDN'T MESS WITH NATURE!,2022-05-01T16:00:02Z,1659012,77194,0,973
n-UppL1ob7c,PEOPLE WHO FELT INSTANT REGRET!,2022-04-28T16:00:21Z,2489631,104377,0,729
BdJLxkx2-1U,PERFECTLY TIMED MOMENTS ON TWITCH!,2022-04-25T16:00:10Z,2434826,100049,0,730
pn9bNSfJZiI,PEOPLE WHO CAN DO THINGS FAST!,2022-04-23T16:00:19Z,1483123,71103,0,1270
jOrrVqRclaE,KSI FUNNIEST MOMENTS #1,2022-04-22T16:00:34Z,3085713,145464,0,892
JTX68oVWA1k,UNEXPECTED MEME COMPILATION,2022-04-21T16:00:13Z,2395573,145454,0,3690
4SZdSPuuWqc,DUMB WAYS TO DIE (UK EDITION),2022-04-20T16:07:12Z,3154271,138069,0,1558
Y6XkMqCP1sc,PEOPLE DYING INSIDE COMPILATION,2022-04-19T16:00:15Z,6020560,223180,0,2652
yG8vKfLjnNc,YOU WON'T BELIEVE THESE GAME SHOWS!,2022-04-18T16:00:28Z,1272124,72269,0,1140
T3v__cXMoZ4,INSTANT REGRET MOMENTS!,2022-04-17T15:00:23Z,3188297,126564,0,1406
gdY59SvWwlY,BEST *OLD SIDEMEN* MOMENTS,2022-04-16T16:00:19Z,4953996,195081,0,1563
0lmXOTmz42c,MOST *SUS* SIDEMEN MOMENTS!,2022-04-14T16:00:00Z,2376339,130901,0,937
x2e6gJOVDRs,STRONGEST PEOPLE NO ONE CAN BEAT! (NOT EVEN KSI),2022-04-13T16:00:27Z,3716029,176990,0,1829
7QxbURD9ThY,MOST BIZZARE THINGS FOUND ON GOOGLE EARTH!,2022-04-12T16:00:03Z,1156776,64328,0,1302
rXp_XejoZwg,MOST INSANE PANIC ROOMS IN THE WORLD!,2022-04-11T16:00:30Z,1507613,71207,0,715
NHaXHVIzOHo,BEST INSTANT KARMA MOMENTS!,2022-04-10T15:00:09Z,2426696,104366,0,642
4kBknx6R6qU,FUNNIEST JEREMY CLARKSON MOMENTS!,2022-04-07T16:00:05Z,2388117,87928,0,737
VY6whOiThsU,FUNNIEST SIDEMEN GAMING MOMENTS,2022-04-06T16:00:25Z,3706805,129515,0,799
D7bTCyFylSA,MOST ICONIC MEMES OF ALL TIME!,2022-04-04T16:00:06Z,2283720,132121,0,2373
ObT4RK_9WaI,FUNNIEST BRITISH MEMES!,2022-04-03T16:00:22Z,2194773,121725,0,962
jO3ciZTb7Ig,MOST ICONIC SIDEMEN MOMENTS OF ALL TIME!,2022-04-01T16:00:33Z,4035277,204585,0,3010
DIoW2FeeNcc,TOP 10 SCARIEST PLACES IN THE WORLD!,2022-03-31T16:00:07Z,1051812,55646,0,1086
i-d9SNj65a0,20 PEOPLE YOU WONT BELIEVE EXIST!,2022-03-30T16:15:02Z,1761842,77707,0,915
6iGE0-MW7Tg,TOP GAMING MOMENTS OF ALL TIME!,2022-03-29T17:00:03Z,1433347,69381,0,850
nTBVMgKzkMA,REACTING TO W2S BEING A SAVAGE,2022-03-28T16:41:51Z,4531007,179419,0,1015
fl_4ghTZJZg,TIKTOKS THAT ARE ACTUALLY FUNNY,2022-03-27T15:00:31Z,3091550,135263,0,636
YfsXItxUj5s,20 GREATEST BOXING KNOCKOUTS OF ALL TIME!,2022-03-21T16:00:26Z,3015070,94606,0,1508
48ay7-NAZ1Y,MOST TALENTED KIDS IN THE WORLD!,2022-03-20T13:00:05Z,1084065,54760,0,684
3HekI_gr7qw,SIDEMEN CENSORED MOMENTS,2022-03-12T17:00:01Z,2587895,114529,0,1758
HotH1TNuFs0,EVERDAY ITEMS WITH SECRET USES YOU DIDNT KNOW!,2022-03-08T17:10:08Z,1994065,82443,0,1102
hVKXRb15ZSA,CRAZIEST MOMENTS CAUGHT ON DASHCAMS!,2022-03-07T17:00:27Z,1392956,72540,0,696
LJQhDKNBI7s,PEOPLE WITH MOST INSANE TALENTS!,2022-03-04T17:15:00Z,1408696,69393,0,656
LwXJaAYXki8,UNUSUAL MEMES COMPILATION #175,2022-03-03T17:15:00Z,2107428,95399,0,761
gcCLoD9T8B8,TWITCH STREAMERS BEING TROLLED BY VIEWERS!,2022-02-28T17:05:37Z,1824156,91748,0,608
axly1wiv2jo,MOST UNBELIEVABLE WORLD RECORDS OF ALL TIME!,2022-02-23T17:15:01Z,3136476,100649,0,1027
q16twcbMeVw,WHEN PEOPLE CELEBRATE TOO EARLY!,2022-02-21T17:00:26Z,1597869,74020,0,781
ReTLcuEauJE,SIDEMEN REACT TO UNUSUAL MEMES V139,2022-02-18T17:00:17Z,1985383,93294,0,695
KUxGcxF0yrU,THE *REAL* RICHEST PEOPLE IN THE WORLD,2022-02-17T17:00:14Z,1584863,73154,0,969
mlqz8d5BVvM,MOST EMBARRASSING RECORDS IN FOOTBALL!,2022-02-12T17:24:49Z,1619935,70738,0,669
Tka916wKr7s,TOP 10 CRAZIEST CHALLENGES MrBeast HAS DONE!,2022-02-10T17:00:13Z,1521719,76227,0,620
Hm8y9JjqATY,FUNNIEST SIDEMEN FAILS OF ALL TIME!,2022-02-04T17:00:10Z,5055137,168216,0,954
atIb1KVRc3k,MOST EXPENSIVE JEWLERY EVER SOLD!,2022-02-03T17:00:02Z,829002,45343,0,786
WjJ1pz0MKQU,MOST VIEWED SIDEMEN SHORTS OF ALL TIME!,2022-02-01T17:00:31Z,1590996,103612,0,657
k0INA2gGDUE,10 FACTS ABOUT EARTH YOU DIDNT LEARN IN SCHOOL!,2022-01-30T17:00:23Z,1277169,66507,0,981
j1sGtYObbeU,SIDEMEN REACT TO AUSTRALIAN DASHCAMS!,2022-01-29T17:00:21Z,2125179,93551,0,1925
hHSIT_iWsF8,TOP 10 MOST EXPENSIVE THINGS IN THE WORLD!,2022-01-24T17:00:29Z,1096451,61177,0,982
l2mYkZ7FxrU,MOST EPIC WAYS PEOPLE QUIT THIER JOBS!,2022-01-20T17:00:28Z,2097115,100191,0,1450
YVg3QAKYP8M,SIDEMEN REACT TO IDIOTS IN CARS,2022-01-18T17:00:21Z,2130149,92005,0,1134
AN9TI_a4oaU,40 THINGS YOU HAVE BEEN DOING WRONG!,2022-01-17T17:00:11Z,1610894,85767,0,940
6xSSWUTdeF4,SIDEMEN REACT TO UNUSUAL MEMES,2022-01-16T17:00:06Z,3501439,128027,0,1175
tOnH9fvrc9A,0 IQ MOMENTS IN SPORTS,2022-01-14T17:00:41Z,3710237,114539,0,1047
-ne8TVLHZeI,BEST OF THE INTERNET 2021!,2022-01-13T17:00:00Z,4273511,137179,0,1108
DJeQrGbUHNg,TOP 10 MOST UNUSUAL VEHICLES!,2022-01-11T17:00:15Z,1128877,58526,0,667
S_36Scj0ASI,PERFECTLY TIMED MOMENTS ON TWITCH!,2022-01-06T17:00:31Z,2825341,115080,0,801
-dsd7B84KtQ,40 WEIRDEST THINGS CAUGHT ON CCTV!,2022-01-04T17:00:00Z,5750762,153511,0,1551
kAmoHpVx_uA,"MOST INSANE ""LIKE A BOSS"" MOMENTS!",2022-01-02T16:30:04Z,4341114,134323,0,1486
x-_mpQLz6oo,MOST EXPENSIVE FAILS CAUGHT ON CAMERA!,2022-01-01T17:44:01Z,1300564,63362,0,1024
MReY1Oa1JGM,MOST ICONIC BRITISH MOMENTS #3,2021-12-27T17:00:27Z,2944117,145283,0,1102
fYki7lslF5Y,"FUNNIEST ""YOU ARE NOT THE FATHER"" MOMENTS",2021-12-20T17:00:22Z,6133681,204078,0,1929
O_og1NkBnrk,MOST LUXURIOUS VEHICLES IN THE WORLD!,2021-12-16T17:00:14Z,1482824,68419,0,1099
8tcCygq__Qk,13 THEORIES THAT WILL BLOW YOUR MIND!,2021-12-13T17:23:35Z,1078516,58978,0,1616
9aysrKUjDoQ,WEIRDEST FACTS ABOUT SEMEN!,2021-12-06T17:00:11Z,1374644,84904,0,1333
w8C0VylKUgo,PEOPLE THAT HAD INSTANT REGRET!,2021-12-05T15:45:01Z,4860445,179973,0,1616
kwapd2QI9Tk,PEOPLE WHO ARE DYING INSIDE!,2021-12-04T18:31:37Z,2987050,124089,0,977
4_yzyn_Im9k,THIS IS HOW THE WORLD ENDS!,2021-12-03T17:00:03Z,2682420,125611,0,2134
p4U89Vg9LYI,19 THINGS YOU HAVE BEEN DOING WRONG!,2021-12-01T17:00:41Z,2634989,136171,0,2184
hLF6sJT1MM0,FOOD ONLY FOUND ON TIKTOK!,2021-11-29T17:00:34Z,3359779,146033,0,3869
DXlOuGBRuhI,COUNTRIES WITH THE BEST SCHOOL LUNCHES!,2021-11-28T17:00:18Z,2587254,97790,0,5089
mJjS6sl4Kn4,1000 IQ PLAYS IN SPORTS!,2021-11-27T17:00:32Z,2581818,92901,0,1056
m9EigJ3wYNY,FUNNIEST FOOTBALL PENALTY MOMENTS!,2021-11-20T17:00:22Z,3049964,108346,0,1077
UKSWC1Ihp4g,ICONIC BRITISH MEMES #2!,2021-11-19T17:54:09Z,6072802,207707,0,2024
_1Oh4SyAE6g,10 RICHEST YOUTUBERS OF 2021!,2021-11-17T17:00:31Z,1633272,106722,0,1240
-GMi7M8nsa4,TOP 10 LIES NORTH KOREA HAS TOLD THE WORLD!,2021-11-16T17:00:00Z,2833211,116275,0,1653
-dQHatKoIzQ,15 COOLEST GADGETS WORTH BUYING!,2021-11-13T17:00:01Z,1492888,70433,0,683
xDD4VYmv_I8,RAREST MOMENTS IN FOOTBALL!,2021-11-12T17:00:40Z,2135599,82316,0,1041
q9YLpq9fMnQ,MOST COMMON BRITISH STEREOTYPES!,2021-11-09T17:02:33Z,2109506,89090,0,2827
HpNLEH4Ip88,TOP 25 MOST INCREDIBLE FOOTBALL GOALS OF THE YEAR,2021-10-29T16:22:41Z,3540279,138137,0,2486
_NaIY3rH1f4,10 FOODS YOU EAT WRONG!,2021-10-27T16:00:33Z,4187347,195495,0,1987
ySCpVl3Tics,IDIOTS IN CARS COMPILATION,2021-10-25T18:10:34Z,1811315,107406,0,2132
0EmfqR4GsaQ,BIGGEST THINGS EVER STOLEN!,2021-10-23T16:00:01Z,4567968,147685,0,2496
_VL7AMVMfV0,TOP 10 FATTEST WILD ANIMALS EVER SEEN,2021-10-21T16:00:30Z,4412898,187214,0,3488
3Wl7SNHQgnE,GORDON RAMSAY ROASTING DUMB TIKTOK FOOD,2021-10-20T16:00:02Z,5951952,189507,0,1984
O0FNTxjgSqc,MOST EXPENSIVE MISTAKES IN HISTORY!,2021-10-17T16:00:06Z,3261776,113640,0,1867
jc8MNFDm0F8,BEST TWITCH FAIL COMPILATION!,2021-10-15T18:04:35Z,3469041,128950,0,1552
L3jTRmITfDU,SIDEMEN REACT TO SQUID GAMES,2021-10-12T16:58:46Z,1799573,90590,0,1860
NkKZvLWRjzg,16 PLACES YOU'RE NOT ALLOWED TO VISIT,2021-10-09T16:00:11Z,4633009,147667,0,2121
Ybmfx2LnjXU,FUNNIEST TROLL MOMENTS IN SPORTS!,2021-10-07T16:00:28Z,3446134,123141,0,2163
ThplxQu1mAU,TOP 10 MYTHS THAT ARE ACTUALLY TRUE,2021-10-06T16:00:14Z,3121087,104371,0,1522
TOPcurKplWc,TOP 10 HIGHEST PAID ATHLETES OF 2021,2021-10-03T16:16:43Z,1743172,85505,0,1311
pkRm97AVT-0,10 RUMORS THAT CAUSED MASS PANIC,2021-10-01T16:00:33Z,3378445,117946,0,1676
udX5QJZ_9ps,CAN HUMANS BRING BACK DINOSAURS?,2021-09-30T16:58:47Z,700239,43940,0,1028
cD6G59IHPlw,TOP 10 WEIRDEST PHOBIAS TO EVER EXIST,2021-09-29T16:00:19Z,2330211,125954,0,4024
VN9KWyEgmV4,SKILLS THAT BROKE THE INTERNET,2021-09-27T16:30:03Z,4095860,167485,0,2103
0tO5zZguHgc,BIGGEST MISTAKES IN FOOTBALL,2021-09-24T16:00:01Z,2923245,107776,0,5731
5LS6t0mYXeY,COULD YOU SLEEP IN THESE AIRBNBs?,2021-09-19T16:00:03Z,918019,46491,0,1293
PV59uHhz2hM,MOST EXPENSIVE SNEAKERS IN THE WORLD!,2021-09-18T16:00:20Z,2958666,112363,0,6958
0uiv6NpYVlA,7 RICHEST KIDS IN THE WORLD!,2021-09-17T17:33:22Z,1455727,79273,0,1663
SYkuK6bhjyY,STRANGEST THINGS TO WASH UP ON SHORE!,2021-09-16T16:00:13Z,1455368,74727,0,1789
P65glIK_pSQ,10 SCHOOL TRIPS THAT WENT HORRIBLY WRONG,2021-09-13T16:00:20Z,5709678,199916,0,3128
uFLHXYIhGeY,BEST LAST MINUTE GOALS IN FOOTBALL!,2021-09-08T16:00:33Z,4756195,173108,0,7640
rB0Ie3B_dws,UNBELIEVABLE HITS IN RUGBY!,2021-09-07T17:01:01Z,3053753,110306,0,5123
E-mHWq16gDQ,WHAT IF ANTARCTICA MELTED?,2021-09-06T16:00:05Z,2968878,162840,0,4016
n-yPw560Z1o,CELEBRITIES WITH WEIRD & HIDDEN TALENTS,2021-09-04T16:00:32Z,3908419,187279,0,2949
8FjAShg7hwk,TOP 5 STRONGEST SIGNS OF ALIENS!,2021-09-02T16:00:02Z,3343786,132256,0,3553
0SwJIcL0XQE,PRISON FOOD FROM AROUND THE WORLD!,2021-09-01T16:00:00Z,5801577,209121,0,3554
BmnfOHRRuvI,Reacting to UK vs US Food Wars: DORITOS,2021-08-29T16:00:03Z,2159975,89520,0,1680
iXRA-BT5aNw,How Floyd Mayweather Spent Half A Billion Dollars!,2021-08-28T16:00:14Z,3165556,159404,0,1440
Ge_1QWFUlBo,REACTING TO KSI MAKING EVERYTHING WEIRD,2021-08-21T16:00:07Z,6437342,244653,0,2279
gkqaR1Ggx6Y,TOP 10 YOUTUBERS WHO HAVE BEEN ARRESTED!,2021-08-20T16:30:03Z,7844845,248478,0,3097
21klfqqAAM0,What $1 Billion Buys You Around the World,2021-08-14T16:00:03Z,3427992,128370,0,2132
nlJ6VJKK7bA,What If Humans Were Never On This Planet?,2021-08-13T16:00:34Z,3049064,133127,0,3344
DpHGqtXTgBo,People That Became Super Rich On Accident!,2021-08-10T16:00:14Z,2072405,109081,0,2158
84DIgnFaxgk,What Was Found In Hitler's Final Will!,2021-08-07T16:00:11Z,2311943,92572,0,1698
fOZU7ITNz18,UNBELIEVEABLE MOMENTS CAUGHT ON CAMERA (SPORTS EDITION),2021-08-06T16:00:20Z,3996177,154033,0,2482
iz0E0atL_Fk,"REACTING TO ""THE 8 YEAR EVOLUTION OF THE SIDEMEN""!",2021-08-01T15:00:17Z,5262643,209092,0,2025
exb8nyTessY,10 Weirdest Attractions in the UK,2021-07-30T16:00:20Z,984057,51513,0,1700
smNuU3XqoFE,WEIRDEST ANCIENT OBJECTS!,2021-07-29T16:00:34Z,2271705,87654,0,1547
8CGcfGQLdYc,MOST CONTROVERSIAL MOVIES EVER!,2021-07-26T16:15:00Z,1452573,69122,0,1404
FB2zvJx6dBA,Most SATISFYING Inventions In The World!,2021-07-25T16:00:06Z,3156356,112429,0,1580
LIBpuB6NWOg,Most EXPENSIVE Items Found In Storage Lockers,2021-07-21T16:00:09Z,2698016,97989,0,1382
mOGBl1SCpe8,Celebrities that Cost Companies BILLIONS,2021-07-20T16:00:31Z,2901057,124829,0,3415
sTQEWkrjxSY,12 Most DISTURBING Craigslist Ads,2021-07-19T16:00:33Z,1978106,92534,0,1608
0M5AY9dNAGo,Most Disrespectful Celebrations in Football!,2021-07-13T16:26:33Z,5130862,181050,0,3070
-eN8uP5aog0,Google's INSANE $1 Billion UK Headquarters!,2021-07-11T12:00:00Z,1077732,57946,0,1416
iro3MoYAY-8,UK vs US Pringles!,2021-07-02T15:00:20Z,2749907,104008,0,3349
2lqzM2EtTLM,Sidemen React to Top W2S Rage Moments!,2021-06-29T15:00:01Z,7212344,289698,0,2965
A40-rN_i0Dc,This Could End The World!,2021-06-25T17:51:12Z,1834736,92699,0,2426
mpsINJPEDgY,Inside Pablo Escobar's Secret Mansion!,2021-06-21T17:30:02Z,1978855,101577,0,1898
RVWvoXlzY00,16 Things You Should NEVER Do Abroad!,2021-06-16T16:00:21Z,1174508,78865,0,2598
-OmKeBMiZG0,"Sidemen React to 'K in KSI Stands for Knowledge""",2021-06-13T16:00:00Z,4827917,224699,0,2506
PaFJhLxEx5w,Sidemen React to Top Gear: The Most Offensive Clips,2021-06-12T16:00:09Z,7123707,275084,0,5947
ZhdFEAsGgtc,Funniest African Movie Scenes,2021-06-06T16:00:14Z,3788302,201124,0,5202
m-TbH4KKiD4,50 Weirdest Laws In The USA,2021-06-02T16:00:32Z,3420253,152836,0,3467
fuxxD1kjlrc,Sidemen React to KSI: The Musical,2021-05-31T16:00:18Z,2571539,178258,0,3040
cYvNCIU2Ri0,Funniest Animal News Bloopers!,2021-05-28T16:00:17Z,3189093,140881,0,1704
OPcJVAb5MGs,Worst Punishments in the History of Mankind,2021-05-25T16:00:23Z,2709572,137039,0,2979
VpGhkC2t7CE,10 Most Powerful Gangsters In History,2021-05-23T16:00:21Z,5287263,178235,0,4667
-7OY8FpjHbc,What Does A Type 6 Civilization Look Like?,2021-05-22T16:00:00Z,4511098,178954,0,5555
aAyrQKFDE0Q,Funniest English Football Chants!,2021-05-16T16:00:01Z,5022773,165133,0,2224
I41IbOmAp6U,Sidemen React to Roadman TikToks,2021-05-08T16:00:08Z,6261652,233126,0,3341
VpGhkC2t7CE,10 Most Powerful Gangsters In History,2021-05-23T16:00:21Z,5287263,178235,0,4667
-7OY8FpjHbc,What Does A Type 6 Civilization Look Like?,2021-05-22T16:00:00Z,4511098,178954,0,5555
aAyrQKFDE0Q,Funniest English Football Chants!,2021-05-16T16:00:01Z,5022773,165133,0,2224
